{
 "version": "0.16.0",
 "generated": "2026-10-11",
 "plays_snapshot": "2026-10-11",
 "method": "Session archaeology, interactive: the 61 upload sessions from data/sessions.json (7-day upload-gap rule; upload dates are NOT recording dates) as an explorable timeline. gaps[] are the 60 inter-session silences in days; clusters[] are 'activity seasons' - consecutive sessions grouped while the separating silence is <= 90 days, a computed browsing convention, not an artist fact. loudest/deepest_cut are the session's max/min play counts (2026-10-11 snapshot); collaborators are w//ft. title credits parsed by the shared rule (producers excluded). Titles and metadata only - never lyrics, never invented bio facts.",
 "gap_rule_days": 7,
 "season_gap_days": 90,
 "archive_totals": {
  "sessions": 61,
  "tracks": 185,
  "total_plays": 257394
 },
 "eras": [
  {
   "id": "the-first-rite",
   "name": "The First Rite",
   "span": "2017 – 2019",
   "deep_dive": "eras/the-first-rite.html",
   "journey": "transmission.html#era-the-first-rite"
  },
  {
   "id": "the-prolific-year",
   "name": "The Prolific Year",
   "span": "2020",
   "deep_dive": "eras/the-prolific-year.html",
   "journey": "transmission.html#era-the-prolific-year"
  },
  {
   "id": "the-cast-it-years",
   "name": "The Cast It: Years",
   "span": "2021 – 2022",
   "deep_dive": "eras/the-cast-it-years.html",
   "journey": "transmission.html#era-the-cast-it-years"
  },
  {
   "id": "the-somelowlifes-era",
   "name": "The SomeLowLifes Era",
   "span": "2023 – 2024",
   "deep_dive": "eras/the-somelowlifes-era.html",
   "journey": "transmission.html#era-the-somelowlifes-era"
  },
  {
   "id": "the-silence",
   "name": "The Silence",
   "span": "2025",
   "deep_dive": "eras/the-silence.html",
   "journey": "transmission.html#era-the-silence"
  },
  {
   "id": "the-return",
   "name": "The Return",
   "span": "2026",
   "deep_dive": "eras/the-return.html",
   "journey": "transmission.html#era-the-return"
  }
 ],
 "sessions": [
  {
   "id": "session-01",
   "name": "The January 3rd–8th Session",
   "start": "2018-01-03",
   "end": "2018-01-08",
   "days": 6,
   "track_count": 2,
   "total_plays": 13862,
   "era_id": "the-first-rite",
   "era_name": "The First Rite",
   "loudest": {
    "title": "Soul Shaking (prod. Fish Narc)",
    "plays": 12944,
    "date": "2018-01-03",
    "page": "releases/soul-shaking-prod-fish-narc.html"
   },
   "deepest_cut": {
    "title": "Lucid Boi (prod. $ T.N.C $)",
    "plays": 918,
    "date": "2018-01-08",
    "page": "releases/lucid-boi-prod-t-n-c.html"
   },
   "collaborators": [],
   "deep_dive": null,
   "journey": "transmission.html#era-the-first-rite",
   "season": "season-01"
  },
  {
   "id": "session-02",
   "name": "The February 4th Session",
   "start": "2018-02-04",
   "end": "2018-02-04",
   "days": 1,
   "track_count": 1,
   "total_plays": 30088,
   "era_id": "the-first-rite",
   "era_name": "The First Rite",
   "loudest": {
    "title": "Take Me (prod. Em Klebold)",
    "plays": 30088,
    "date": "2018-02-04",
    "page": "releases/take-me-prod-em-klebold.html"
   },
   "deepest_cut": {
    "title": "Take Me (prod. Em Klebold)",
    "plays": 30088,
    "date": "2018-02-04",
    "page": "releases/take-me-prod-em-klebold.html"
   },
   "collaborators": [],
   "deep_dive": null,
   "journey": "transmission.html#era-the-first-rite",
   "season": "season-01"
  },
  {
   "id": "session-03",
   "name": "The March 16th Session",
   "start": "2018-03-16",
   "end": "2018-03-16",
   "days": 1,
   "track_count": 1,
   "total_plays": 1008,
   "era_id": "the-first-rite",
   "era_name": "The First Rite",
   "loudest": {
    "title": "I See U (prod. Haruhi)",
    "plays": 1008,
    "date": "2018-03-16",
    "page": "releases/i-see-u-prod-haruhi.html"
   },
   "deepest_cut": {
    "title": "I See U (prod. Haruhi)",
    "plays": 1008,
    "date": "2018-03-16",
    "page": "releases/i-see-u-prod-haruhi.html"
   },
   "collaborators": [],
   "deep_dive": null,
   "journey": "transmission.html#era-the-first-rite",
   "season": "season-01"
  },
  {
   "id": "session-04",
   "name": "The April 28th Session",
   "start": "2018-04-28",
   "end": "2018-04-28",
   "days": 1,
   "track_count": 1,
   "total_plays": 1400,
   "era_id": "the-first-rite",
   "era_name": "The First Rite",
   "loudest": {
    "title": "Mistakes Ft. JO$E DRIPP (prod. Tec)",
    "plays": 1400,
    "date": "2018-04-28",
    "page": "releases/mistakes-ft-jo-e-dripp-prod-tec.html"
   },
   "deepest_cut": {
    "title": "Mistakes Ft. JO$E DRIPP (prod. Tec)",
    "plays": 1400,
    "date": "2018-04-28",
    "page": "releases/mistakes-ft-jo-e-dripp-prod-tec.html"
   },
   "collaborators": [
    "JO$E DRIPP"
   ],
   "deep_dive": null,
   "journey": "transmission.html#era-the-first-rite",
   "season": "season-01"
  },
  {
   "id": "session-05",
   "name": "The June 8th–14th Session",
   "start": "2018-06-08",
   "end": "2018-06-14",
   "days": 7,
   "track_count": 2,
   "total_plays": 3030,
   "era_id": "the-first-rite",
   "era_name": "The First Rite",
   "loudest": {
    "title": "That's a Lie (prod. Xtravulous x WhyLoner)",
    "plays": 1522,
    "date": "2018-06-08",
    "page": "releases/that-s-a-lie-prod-xtravulous-x-whyloner.html"
   },
   "deepest_cut": {
    "title": "Place For Me(prod. Born Hero)",
    "plays": 1508,
    "date": "2018-06-14",
    "page": "releases/place-for-me-prod-born-hero.html"
   },
   "collaborators": [],
   "deep_dive": null,
   "journey": "transmission.html#era-the-first-rite",
   "season": "season-01"
  },
  {
   "id": "session-06",
   "name": "The July 1st Session",
   "start": "2018-07-01",
   "end": "2018-07-01",
   "days": 1,
   "track_count": 1,
   "total_plays": 1282,
   "era_id": "the-first-rite",
   "era_name": "The First Rite",
   "loudest": {
    "title": "Take Me Back to the City (prod. RainyBaby)",
    "plays": 1282,
    "date": "2018-07-01",
    "page": "releases/take-me-back-to-the-city-prod-rainybaby.html"
   },
   "deepest_cut": {
    "title": "Take Me Back to the City (prod. RainyBaby)",
    "plays": 1282,
    "date": "2018-07-01",
    "page": "releases/take-me-back-to-the-city-prod-rainybaby.html"
   },
   "collaborators": [],
   "deep_dive": null,
   "journey": "transmission.html#era-the-first-rite",
   "season": "season-01"
  },
  {
   "id": "session-07",
   "name": "The July 18th–20th Session",
   "start": "2018-07-18",
   "end": "2018-07-20",
   "days": 3,
   "track_count": 4,
   "total_plays": 12163,
   "era_id": "the-first-rite",
   "era_name": "The First Rite",
   "loudest": {
    "title": "When the World Gets Colder (prod. Brokn)",
    "plays": 9535,
    "date": "2018-07-18",
    "page": "releases/when-the-world-gets-colder-prod-brokn.html"
   },
   "deepest_cut": {
    "title": "As Above [So Below] (prod. Xtravulous x Young Taylor)",
    "plays": 757,
    "date": "2018-07-20",
    "page": "releases/as-above-so-below-prod-xtravulous-x-young-taylor.html"
   },
   "collaborators": [],
   "deep_dive": null,
   "journey": "transmission.html#era-the-first-rite",
   "season": "season-01"
  },
  {
   "id": "session-08",
   "name": "The August 4th Session",
   "start": "2018-08-04",
   "end": "2018-08-04",
   "days": 1,
   "track_count": 1,
   "total_plays": 1602,
   "era_id": "the-first-rite",
   "era_name": "The First Rite",
   "loudest": {
    "title": "all i really need is a text from u (prod. benizjaminn)",
    "plays": 1602,
    "date": "2018-08-04",
    "page": "releases/all-i-really-need-is-a-text-from-u-prod-benizjaminn.html"
   },
   "deepest_cut": {
    "title": "all i really need is a text from u (prod. benizjaminn)",
    "plays": 1602,
    "date": "2018-08-04",
    "page": "releases/all-i-really-need-is-a-text-from-u-prod-benizjaminn.html"
   },
   "collaborators": [],
   "deep_dive": null,
   "journey": "transmission.html#era-the-first-rite",
   "season": "season-01"
  },
  {
   "id": "session-09",
   "name": "The August 13th–27th Session",
   "start": "2018-08-13",
   "end": "2018-08-27",
   "days": 15,
   "track_count": 7,
   "total_plays": 10571,
   "era_id": "the-first-rite",
   "era_name": "The First Rite",
   "loudest": {
    "title": "Just Wanted U to Shine (prod. Xtravulous x Tundra Beats)",
    "plays": 3096,
    "date": "2018-08-26",
    "page": "releases/just-wanted-u-to-shine-prod-xtravulous-x-tundra-beats.html"
   },
   "deepest_cut": {
    "title": "I Don't Rlly (prod. FELD)",
    "plays": 587,
    "date": "2018-08-27",
    "page": "releases/i-don-t-rlly-prod-feld.html"
   },
   "collaborators": [
    "JAX",
    "Max Ferrari"
   ],
   "deep_dive": "sessions/the-august-13th-27th-session.html",
   "journey": "transmission.html#era-the-first-rite",
   "season": "season-01"
  },
  {
   "id": "session-10",
   "name": "The September 6th Session",
   "start": "2018-09-06",
   "end": "2018-09-06",
   "days": 1,
   "track_count": 1,
   "total_plays": 1485,
   "era_id": "the-first-rite",
   "era_name": "The First Rite",
   "loudest": {
    "title": "Autumn (prod. Tundra Beats)",
    "plays": 1485,
    "date": "2018-09-06",
    "page": "releases/autumn-prod-tundra-beats.html"
   },
   "deepest_cut": {
    "title": "Autumn (prod. Tundra Beats)",
    "plays": 1485,
    "date": "2018-09-06",
    "page": "releases/autumn-prod-tundra-beats.html"
   },
   "collaborators": [],
   "deep_dive": null,
   "journey": "transmission.html#era-the-first-rite",
   "season": "season-01"
  },
  {
   "id": "session-11",
   "name": "The October 6th Session",
   "start": "2018-10-06",
   "end": "2018-10-06",
   "days": 1,
   "track_count": 1,
   "total_plays": 2149,
   "era_id": "the-first-rite",
   "era_name": "The First Rite",
   "loudest": {
    "title": "Inside My Dome (prod. Karattt)",
    "plays": 2149,
    "date": "2018-10-06",
    "page": "releases/inside-my-dome-prod-karattt.html"
   },
   "deepest_cut": {
    "title": "Inside My Dome (prod. Karattt)",
    "plays": 2149,
    "date": "2018-10-06",